{
  "schema_version": "0.6",
  "contract_id": "contract-demo-1",
  "project_id": "demo",
  "task_id": "task-demo-1",
  "version": 1,
  "criteria": [
    {
      "criterion_id": "artifact-1",
      "class": "artifact",
      "required": true,
      "verifier_id": "core.artifact",
      "verifier_version": "1",
      "expectation": "A trusted attempt manifest binds blob:demo-1 and its SHA-256 to this attempt."
    }
  ],
  "digest": "2d1910770bd24bc9cc142169a19563913252d603d90c08652793563c12b37ba4"
}
